{
  "schema": "z3-encoding-summary-v1",
  "semantics": "encoding-order",
  "engine": "wang-z3",
  "source_formula_sha256": "3caaa6b29ac988fb4f51cc7071202d83ea1591ba6170e683b6da449cb3641542",
  "region_sha256": "aad4dc7dcb46ed070995bf975248a7f2f0bf27d69db3eb653208d08c5826199a",
  "z3": {
    "version": "5.1.0",
    "parameters": {
      "random_seed": 0,
      "threads": 1
    }
  },
  "status": "sat",
  "encoding": {
    "order": [
      "cells:row-major",
      "directions:N,E,S,W",
      "tile-tuples:first-positional-id",
      "cell-relation-before-boundary",
      "boundary-directions:N,E,S,W"
    ],
    "variable_count": 3,
    "width": 41,
    "height": 11,
    "active_cell_count": 444,
    "edge_term_count": 944,
    "shared_internal_edge_count": 832,
    "unique_tile_tuple_count": 23,
    "assertion_count": 556
  },
  "model": {
    "assignment": null,
    "cells": [
      0,
      7,
      7,
      7,
      7,
      11,
      12,
      7,
      11,
      12,
      7,
      7,
      11,
      12,
      7,
      7,
      7,
      7,
      7,
      7,
      11,
      12,
      7,
      7,
      7,
      7,
      7,
      11,
      12,
      7,
      7,
      7,
      7,
      7,
      7,
      11,
      12,
      7,
      7,
      4,
      null,
      1,
      7,
      7,
      7,
      11,
      12,
      7,
      11,
      12,
      7,
      7,
      11,
      12,
      7,
      7,
      7,
      7,
      7,
      7,
      11,
      12,
      7,
      7,
      7,
      7,
      7,
      11,
      12,
      7,
      7,
      7,
      7,
      7,
      7,
      11,
      12,
      7,
      7,
      7,
      7,
      4,
      2,
      7,
      7,
      11,
      12,
      7,
      7,
      19,
      8,
      8,
      13,
      14,
      8,
      8,
      8,
      8,
      8,
      8,
      13,
      14,
      8,
      8,
      8,
      8,
      8,
      13,
      14,
      8,
      8,
      8,
      8,
      8,
      8,
      13,
      14,
      8,
      8,
      8,
      8,
      8,
      8,
      7,
      7,
      7,
      19,
      8,
      8,
      8,
      20,
      7,
      7,
      15,
      7,
      7,
      7,
      7,
      7,
      7,
      11,
      12,
      7,
      7,
      7,
      7,
      7,
      11,
      12,
      7,
      7,
      7,
      7,
      7,
      7,
      11,
      12,
      7,
      7,
      7,
      7,
      7,
      null,
      null,
      3,
      8,
      8,
      20,
      7,
      7,
      7,
      9,
      7,
      7,
      16,
      7,
      7,
      7,
      7,
      7,
      11,
      12,
      7,
      7,
      7,
      7,
      7,
      11,
      12,
      7,
      7,
      7,
      7,
      7,
      7,
      11,
      12,
      7,
      7,
      7,
      7,
      7,
      7,
      4,
      null,
      3,
      8,
      8,
      10,
      8,
      8,
      8,
      10,
      8,
      8,
      10,
      8,
      8,
      8,
      8,
      13,
      14,
      8,
      8,
      8,
      8,
      8,
      13,
      14,
      8,
      8,
      8,
      8,
      8,
      8,
      13,
      14,
      8,
      8,
      8,
      8,
      8,
      8,
      8,
      8,
      5,
      3,
      8,
      8,
      10,
      8,
      8,
      8,
      10,
      8,
      8,
      10,
      8,
      8,
      8,
      13,
      14,
      8,
      8,
      8,
      8,
      8,
      8,
      17,
      7,
      7,
      7,
      7,
      7,
      7,
      11,
      12,
      7,
      7,
      7,
      7,
      7,
      7,
      7,
      7,
      7,
      6,
      7,
      7,
      7,
      9,
      7,
      7,
      7,
      9,
      7,
      7,
      9,
      7,
      7,
      7,
      15,
      7,
      7,
      7,
      7,
      7,
      7,
      7,
      18,
      8,
      8,
      8,
      8,
      8,
      8,
      17,
      7,
      7,
      7,
      7,
      7,
      7,
      7,
      7,
      7,
      null,
      null,
      0,
      7,
      7,
      9,
      7,
      7,
      7,
      9,
      7,
      7,
      9,
      7,
      7,
      7,
      16,
      7,
      7,
      7,
      7,
      7,
      7,
      7,
      9,
      7,
      7,
      7,
      7,
      7,
      7,
      18,
      8,
      8,
      8,
      8,
      8,
      8,
      8,
      8,
      8,
      5,
      null,
      1,
      7,
      7,
      9,
      7,
      7,
      7,
      9,
      7,
      7,
      9,
      7,
      7,
      7,
      9,
      7,
      7,
      7,
      7,
      7,
      7,
      7,
      9,
      7,
      7,
      7,
      7,
      7,
      7,
      9,
      7,
      7,
      7,
      7,
      7,
      7,
      7,
      7,
      7,
      6,
      5,
      2,
      7,
      7,
      9,
      7,
      7,
      7,
      9,
      7,
      7,
      9,
      7,
      7,
      7,
      9,
      7,
      7,
      7,
      7,
      7,
      7,
      7,
      9,
      7,
      7,
      7,
      7,
      7,
      7,
      9,
      7,
      7,
      7,
      7,
      7,
      7,
      7,
      7,
      7,
      7,
      6
    ]
  },
  "statistics": [
    {
      "name": "active-cells",
      "value": 444
    },
    {
      "name": "edge-terms",
      "value": 944
    },
    {
      "name": "shared-internal-edges",
      "value": 832
    },
    {
      "name": "assertions",
      "value": 556
    },
    {
      "name": "model-entries",
      "value": 451
    }
  ]
}
